{
  "schema_id": "reasoning.platform.pricing",
  "schema_version": "1.0.0-alpha.2",
  "pricing_lifecycle_id": "pricing_hybrid_cancelled_pre_dispatch",
  "operation": {
    "operation_id": "operation_hybrid_cancelled_pre_dispatch",
    "kind": "hybrid",
    "actor": {"type": "user", "id": "user_alice"},
    "tenant_id": "tenant_alpha",
    "project_id": "project_local_algebra",
    "idempotency_key": "hybrid-cancelled-before-dispatch-001",
    "request_digest": "sha256:9292929292929292929292929292929292929292929292929292929292929292",
    "route_plan_id": "route_plan_hybrid_cancelled_pre_dispatch"
  },
  "quote": {
    "quote_id": "quote_hybrid_cancelled_pre_dispatch",
    "sequence": 1,
    "issued_at": "2026-09-01T21:00:00Z",
    "expires_at": "2026-09-01T21:10:00Z",
    "currency": "USD",
    "dimensions": [
      {
        "component_id": "price_component_cancelled_input",
        "kind": "inference",
        "meter": "input_tokens",
        "maximum_quantity": "100000",
        "unit_price": "0.000002",
        "maximum_amount": "0.200000",
        "basis": "catalog"
      },
      {
        "component_id": "price_component_cancelled_output",
        "kind": "inference",
        "meter": "output_tokens",
        "maximum_quantity": "20000",
        "unit_price": "0.000010",
        "maximum_amount": "0.200000",
        "basis": "catalog"
      },
      {
        "component_id": "price_component_cancelled_vcpu",
        "kind": "compute",
        "meter": "vcpu_seconds",
        "maximum_quantity": "600",
        "unit_price": "0.000500",
        "maximum_amount": "0.300000",
        "basis": "operator_rate"
      },
      {
        "component_id": "price_component_cancelled_memory",
        "kind": "compute",
        "meter": "memory_gib_seconds",
        "maximum_quantity": "3000",
        "unit_price": "0.000100",
        "maximum_amount": "0.300000",
        "basis": "operator_rate"
      }
    ],
    "maximum_amount": "1.000000",
    "assumptions": ["The user may cancel before either selected service is dispatched."],
    "catalog_digest": "sha256:8888888888888888888888888888888888888888888888888888888888888888"
  },
  "reservation": {
    "reservation_id": "reservation_hybrid_cancelled_pre_dispatch",
    "sequence": 2,
    "quote_id": "quote_hybrid_cancelled_pre_dispatch",
    "state": "reserved",
    "reserved_at": "2026-09-01T21:00:30Z",
    "currency": "USD",
    "reserved_amount": "1.000000",
    "funding": "paid_balance",
    "persisted_with_operation": true
  },
  "dispatches": [],
  "usage": [],
  "settlement": {
    "settlement_id": "settlement_hybrid_cancelled_pre_dispatch",
    "sequence": 3,
    "state": "released",
    "release_phase": "pre_dispatch",
    "release_reason": "cancelled_before_dispatch",
    "reservation_id": "reservation_hybrid_cancelled_pre_dispatch",
    "released_at": "2026-09-01T21:02:00Z",
    "currency": "USD",
    "actual_amount": "0",
    "released_amount": "1.000000",
    "reservation_state": "released",
    "atomic": true
  }
}
